Sheet: starts-with-match
B2: case | C2: nodejs | D2: machine | E2: method | F2: Stage | G2: Total Time(ms) | H2: Trials | I2: avg time | J2: Raw result
B3: Ends-with-match | C3: 5.2.0 | D3: mac book pro (work) | E3: string.match(string) | F3: Preparation | G3: 240.727 | H3: 1000000 | I3: of:=[.G3]/[.H3] -> 0.000240727 | J3: starts-with-match using string.match(string) empty preparation: 240.727ms
B4: Ends-with-match | C4: 5.2.0 | D4: mac book pro (work) | E4: string.match(string) | F4: Execution | G4: 5719.001 | H4: 1000000 | I4: of:=[.G4]/[.H4] -> 0.005719001 | J4: starts-with-match using string.match(string) empty execution: 5719.001ms
B5: Ends-with-match | C5: 5.2.0 | D5: mac book pro (work) | E5: string.match(string) | F5: Preparation | G5: 546.408 | H5: 1000000 | I5: of:=[.G5]/[.H5] -> 0.000546408 | J5: .starts-with-match using string.match(string) ends with preparation: 246.408ms
B6: Ends-with-match | C6: 5.2.0 | D6: mac book pro (work) | E6: string.match(string) | F6: Execution | G6: 5942.987 | H6: 1000000 | I6: of:=[.G6]/[.H6] -> 0.005942987 | J6: starts-with-match using string.match(string) ends with execution: 5942.987ms
B7: Ends-with-match | C7: 5.2.0 | D7: mac book pro (work) | E7: string.match(string) | F7: Preparation | G7: 274.248 | H7: 1000000 | I7: of:=[.G7]/[.H7] -> 0.000274248 | J7: .starts-with-match using string.match(string) double * preparation: 274.248ms
B8: Ends-with-match | C8: 5.2.0 | D8: mac book pro (work) | E8: string.match(string) | F8: Execution | G8: 6015.196 | H8: 1000000 | I8: of:=[.G8]/[.H8] -> 0.006015196 | J8: starts-with-match using string.match(string) double * execution: 6015.196ms
B9: Ends-with-match | C9: 5.2.0 | D9: mac book pro (work) | E9: string.match(string) | F9: Preparation | G9: 301.425 | H9: 1000000 | I9: of:=[.G9]/[.H9] -> 0.000301425 | J9: .starts-with-match using string.match(string) no match preparation: 301.425ms
B10: Ends-with-match | C10: 5.2.0 | D10: mac book pro (work) | E10: string.match(string) | F10: Execution | G10: 5951.467 | H10: 1000000 | I10: of:=[.G10]/[.H10] -> 0.005951467 | J10: starts-with-match using string.match(string) no match execution: 5951.467ms
B11: Ends-with-match | C11: 5.2.0 | D11: mac book pro (work) | E11: string.match(RegExp) | F11: Preparation | G11: 543.23 | H11: 1000000 | I11: of:=[.G11]/[.H11] -> 0.00054323 | J11: .starts-with-match using string.match(RegExp) empty preparation: 543.230ms
B12: Ends-with-match | C12: 5.2.0 | D12: mac book pro (work) | E12: string.match(RegExp) | F12: Execution | G12: 5221.62 | H12: 1000000 | I12: of:=[.G12]/[.H12] -> 0.00522162 | J12: starts-with-match using string.match(RegExp) empty execution: 5221.620ms
B13: Ends-with-match | C13: 5.2.0 | D13: mac book pro (work) | E13: string.match(RegExp) | F13: Preparation | G13: 627.752 | H13: 1000000 | I13: of:=[.G13]/[.H13] -> 0.000627752 | J13: .starts-with-match using string.match(RegExp) ends with preparation: 627.752ms
B14: Ends-with-match | C14: 5.2.0 | D14: mac book pro (work) | E14: string.match(RegExp) | F14: Execution | G14: 5150.127 | H14: 1000000 | I14: of:=[.G14]/[.H14] -> 0.005150127 | J14: starts-with-match using string.match(RegExp) ends with execution: 5150.127ms
B15: Ends-with-match | C15: 5.2.0 | D15: mac book pro (work) | E15: string.match(RegExp) | F15: Preparation | G15: 854.045 | H15: 1000000 | I15: of:=[.G15]/[.H15] -> 0.000854045 | J15: .starts-with-match using string.match(RegExp) double * preparation: 854.045ms
B16: Ends-with-match | C16: 5.2.0 | D16: mac book pro (work) | E16: string.match(RegExp) | F16: Execution | G16: 5635.652 | H16: 1000000 | I16: of:=[.G16]/[.H16] -> 0.005635652 | J16: starts-with-match using string.match(RegExp) double * execution: 5635.652ms
B17: Ends-with-match | C17: 5.2.0 | D17: mac book pro (work) | E17: string.match(RegExp) | F17: Preparation | G17: 590.53 | H17: 1000000 | I17: of:=[.G17]/[.H17] -> 0.00059053 | J17: .starts-with-match using string.match(RegExp) no match preparation: 590.530ms
B18: Ends-with-match | C18: 5.2.0 | D18: mac book pro (work) | E18: string.match(RegExp) | F18: Execution | G18: 5354.005 | H18: 1000000 | I18: of:=[.G18]/[.H18] -> 0.005354005 | J18: starts-with-match using string.match(RegExp) no match execution: 5354.005ms
B19: Ends-with-match | C19: 5.2.0 | D19: mac book pro (work) | E19: regex.test | F19: Preparation | G19: 522.772 | H19: 1000000 | I19: of:=[.G19]/[.H19] -> 0.000522772 | J19: .starts-with-match using regex.test empty preparation: 522.772ms
B20: Ends-with-match | C20: 5.2.0 | D20: mac book pro (work) | E20: regex.test | F20: Execution | G20: 5708.104 | H20: 1000000 | I20: of:=[.G20]/[.H20] -> 0.005708104 | J20: starts-with-match using regex.test empty execution: 5708.104ms
B21: Ends-with-match | C21: 5.2.0 | D21: mac book pro (work) | E21: regex.test | F21: Preparation | G21: 711.417 | H21: 1000000 | I21: of:=[.G21]/[.H21] -> 0.000711417 | J21: .starts-with-match using regex.test ends with preparation: 711.417ms
B22: Ends-with-match | C22: 5.2.0 | D22: mac book pro (work) | E22: regex.test | F22: Execution | G22: 4989.931 | H22: 1000000 | I22: of:=[.G22]/[.H22] -> 0.004989931 | J22: starts-with-match using regex.test ends with execution: 4989.931ms
B23: Ends-with-match | C23: 5.2.0 | D23: mac book pro (work) | E23: regex.test | F23: Preparation | G23: 676.729 | H23: 1000000 | I23: of:=[.G23]/[.H23] -> 0.000676729 | J23: .starts-with-match using regex.test double * preparation: 676.729ms
B24: Ends-with-match | C24: 5.2.0 | D24: mac book pro (work) | E24: regex.test | F24: Execution | G24: 6826.116 | H24: 1000000 | I24: of:=[.G24]/[.H24] -> 0.006826116 | J24: starts-with-match using regex.test double * execution: 6826.116ms
B25: Ends-with-match | C25: 5.2.0 | D25: mac book pro (work) | E25: regex.test | F25: Preparation | G25: 553.648 | H25: 1000000 | I25: of:=[.G25]/[.H25] -> 0.000553648 | J25: .starts-with-match using regex.test no match preparation: 553.648ms
B26: Ends-with-match | C26: 5.2.0 | D26: mac book pro (work) | E26: regex.test | F26: Execution | G26: 6680.573 | H26: 1000000 | I26: of:=[.G26]/[.H26] -> 0.006680573 | J26: starts-with-match using regex.test no match execution: 6680.573ms
B27: Ends-with-match | C27: 5.2.0 | D27: mac book pro (work) | E27: Pattern | F27: Preparation | G27: 711.532 | H27: 1000000 | I27: of:=[.G27]/[.H27] -> 0.000711532 | J27: .starts-with-match using Pattern empty preparation: 711.532ms
B28: Ends-with-match | C28: 5.2.0 | D28: mac book pro (work) | E28: Pattern | F28: Execution | G28: 19573.4 | H28: 1000000 | I28: of:=[.G28]/[.H28] -> 0.0195734 | J28: starts-with-match using Pattern empty execution: 19573.400ms
B29: Ends-with-match | C29: 5.2.0 | D29: mac book pro (work) | E29: Pattern | F29: Preparation | G29: 1302.559 | H29: 1000000 | I29: of:=[.G29]/[.H29] -> 0.001302559 | J29: .starts-with-match using Pattern ends with preparation: 1302.559ms
B30: Ends-with-match | C30: 5.2.0 | D30: mac book pro (work) | E30: Pattern | F30: Execution | G30: 19496.656 | H30: 1000000 | I30: of:=[.G30]/[.H30] -> 0.019496656 | J30: starts-with-match using Pattern ends with execution: 19496.656ms
B31: Ends-with-match | C31: 5.2.0 | D31: mac book pro (work) | E31: Pattern | F31: Preparation | G31: 1330.409 | H31: 1000000 | I31: of:=[.G31]/[.H31] -> 0.001330409 | J31: .starts-with-match using Pattern double * preparation: 1330.409ms
B32: Ends-with-match | C32: 5.2.0 | D32: mac book pro (work) | E32: Pattern | F32: Execution | G32: 18472.178 | H32: 1000000 | I32: of:=[.G32]/[.H32] -> 0.018472178 | J32: starts-with-match using Pattern double * execution: 18472.178ms
B33: Ends-with-match | C33: 5.2.0 | D33: mac book pro (work) | E33: Pattern | F33: Preparation | G33: 1059.144 | H33: 1000000 | I33: of:=[.G33]/[.H33] -> 0.001059144 | J33: .starts-with-match using Pattern no match preparation: 1059.144ms
B34: Ends-with-match | C34: 5.2.0 | D34: mac book pro (work) | E34: Pattern | F34: Execution | G34: 16116.755 | H34: 1000000 | I34: of:=[.G34]/[.H34] -> 0.016116755 | J34: starts-with-match using Pattern no match execution: 16116.755ms
B35: Ends-with-match | C35: 5.2.0 | D35: mac book pro (work) | E35: for..charAt | F35: Preparation | G35: 51.344 | H35: 1000000 | I35: of:=[.G35]/[.H35] -> 0.000051344 | J35: .starts-with-match using for..charAt empty preparation: 51.344ms
B37: Ends-with-match | C37: 5.2.0 | D37: mac book pro (work) | E37: string.match(string) | F37: Preparation | G37: 235.953 | H37: 1000000 | I37: of:=[.G37]/[.H37] -> 0.000235953 | J37: starts-with-match using string.match(string) empty preparation: 235.953ms
J38: starts-with-match using string.match(string) empty execution: 6131.008ms
J39: .starts-with-matchusingstring.match(string)ends withpreparation: 300.023ms
J40: starts-with-match using string.match(string) ends with execution: 6123.175ms
J41: .starts-with-matchusingstring.match(string)double *preparation: 311.036ms
J42: starts-with-match using string.match(string) double * execution: 6575.603ms
J43: .starts-with-matchusingstring.match(string)no matchpreparation: 333.262ms
J44: starts-with-match using string.match(string) no match execution: 6604.114ms
J45: .starts-with-matchusingstring.match(RegExp)emptypreparation: 526.312ms
J46: starts-with-match using string.match(RegExp) empty execution: 5517.400ms
J47: .starts-with-matchusingstring.match(RegExp)ends withpreparation: 590.891ms
J48: starts-with-match using string.match(RegExp) ends with execution: 5414.137ms
J49: .starts-with-matchusingstring.match(RegExp)double *preparation: 699.242ms
J50: starts-with-match using string.match(RegExp) double * execution: 6010.485ms
J51: .starts-with-matchusingstring.match(RegExp)no matchpreparation: 600.788ms
J52: starts-with-match using string.match(RegExp) no match execution: 5599.482ms
J53: .starts-with-matchusingregex.testemptypreparation: 504.025ms
J54: starts-with-match using regex.test empty execution: 6340.448ms
J55: .starts-with-matchusingregex.testends withpreparation: 553.496ms
J56: starts-with-match using regex.test ends with execution: 5416.671ms
J57: .starts-with-matchusingregex.testdouble *preparation: 665.125ms
J58: starts-with-match using regex.test double * execution: 6465.017ms
J59: .starts-with-matchusingregex.testno matchpreparation: 677.724ms
J60: starts-with-match using regex.test no match execution: 6663.891ms
J61: .starts-with-matchusingPatternemptypreparation: 720.559ms
J62: starts-with-match using Pattern empty execution: 21960.741ms
J63: .starts-with-matchusingPatternends withpreparation: 908.967ms
J64: starts-with-match using Pattern ends with execution: 20360.957ms
J65: .starts-with-matchusingPatterndouble *preparation: 1175.347ms
J66: starts-with-match using Pattern double * execution: 15901.985ms
J67: .starts-with-matchusingPatternno matchpreparation: 861.187ms
J68: starts-with-match using Pattern no match execution: 17050.659ms
J69: .starts-with-matchusingfor..charAtemptypreparation: 58.563ms
J70: starts-with-match using for..charAt empty execution: 19632.938ms
J71: .starts-with-matchusingfor..charAtends withpreparation: 52.408ms
J72: starts-with-match using for..charAt ends with execution: 31510.898ms
J73: .starts-with-matchusingfor..charAtdouble *preparation: 814.707ms
J74: starts-with-match using for..charAt double * execution: 43164.130ms
J75: .starts-with-matchusingfor..charAtno matchpreparation: 1948.962ms
J76: starts-with-match using for..charAt no match execution: 52116.747ms
J77: .starts-with-matchusingendsWithemptypreparation: 291.229ms
J78: starts-with-match using endsWith empty execution: 61971.797ms
J79: .starts-with-matchusingendsWithends withpreparation: 3037.562ms